{
  "id": "WASM-POS-018",
  "version": "v1",
  "kind": "positive",
  "category": "capability",
  "description": "Clock capability is allowed only in virtualized deterministic mode.",
  "profile": "deterministic_v1",
  "input": {
    "abi_version": "v1",
    "module_ref": "fixtures/modules/virtual_clock_stable.wasm",
    "payload_ref": "fixtures/payloads/minimal_valid.json",
    "capabilities": ["compute", "clock"]
  },
  "expected": {
    "decision": "allow",
    "code": "OK",
    "receipt_claims": [
      "wasm.module.sha256",
      "wasm.abi.version",
      "wasm.profile",
      "wasm.fuel.used",
      "wasm.verify.status"
    ]
  }
}
