{
  "id": "WASM-POS-005",
  "version": "v1",
  "kind": "positive",
  "category": "abi",
  "description": "Large but valid payload under ABI v1 succeeds.",
  "profile": "deterministic_v1",
  "input": {
    "abi_version": "v1",
    "module_ref": "fixtures/modules/noop_valid.wasm",
    "payload_ref": "fixtures/payloads/large_valid.json",
    "capabilities": ["compute"]
  },
  "expected": {
    "decision": "allow",
    "code": "OK",
    "receipt_claims": [
      "wasm.module.sha256",
      "wasm.abi.version",
      "wasm.profile",
      "wasm.fuel.used",
      "wasm.verify.status"
    ]
  }
}
