{
  "id": "WASM-POS-009",
  "version": "v1",
  "kind": "positive",
  "category": "capability",
  "description": "Bounded memory usage capability remains within policy.",
  "profile": "deterministic_v1",
  "input": {
    "abi_version": "v1",
    "module_ref": "fixtures/modules/memory_bounded.wasm",
    "payload_ref": "fixtures/payloads/minimal_valid.json",
    "capabilities": ["compute", "memory"]
  },
  "expected": {
    "decision": "allow",
    "code": "OK",
    "receipt_claims": [
      "wasm.module.sha256",
      "wasm.abi.version",
      "wasm.profile",
      "wasm.fuel.used",
      "wasm.verify.status"
    ]
  }
}
