{
  "id": "WASM-POS-017",
  "version": "v1",
  "kind": "positive",
  "category": "verify",
  "description": "Supported signature algorithm validates successfully.",
  "profile": "deterministic_v1",
  "input": {
    "abi_version": "v1",
    "module_ref": "fixtures/modules/signed_ed25519.wasm",
    "payload_ref": "fixtures/payloads/minimal_valid.json",
    "capabilities": ["compute"]
  },
  "expected": {
    "decision": "allow",
    "code": "OK",
    "receipt_claims": [
      "wasm.module.sha256",
      "wasm.abi.version",
      "wasm.profile",
      "wasm.fuel.used",
      "wasm.verify.status"
    ]
  }
}
