{
  "id": "WASM-POS-010",
  "version": "v1",
  "kind": "positive",
  "category": "determinism",
  "description": "Seeded RNG path is deterministic and allowed.",
  "profile": "deterministic_v1",
  "input": {
    "abi_version": "v1",
    "module_ref": "fixtures/modules/seeded_rng_stable.wasm",
    "payload_ref": "fixtures/payloads/replay_case_a.json",
    "capabilities": ["compute", "rng"]
  },
  "expected": {
    "decision": "allow",
    "code": "OK",
    "receipt_claims": [
      "wasm.module.sha256",
      "wasm.abi.version",
      "wasm.profile",
      "wasm.fuel.used",
      "wasm.verify.status"
    ]
  }
}
